biased_sentence,biased_words,rephrase_possible,debiased_sentence
"The damages bankruptcy inflicts on debtors looks appealing to the twenty percent who say they’ll be in debt until they die. Obama’s proposed change could start a run that would greatly increase costs to the federal government and, by extension, taxpayers.","['increase', 'appealing', 'greatly']",yes,"The damages bankruptcy inflicts on debtors looks concerning to the twenty percent who say they’ll be in debt until they die. Obama’s proposed change could start a run that would significantly raise costs to the federal government and, by extension, taxpayers."
"Their work came on the heels of an IPCC report that warned of dire environmental, economic and health consequences in the absence of any serious momentum toward decarbonization by 2030.",['dire'],yes,"Their work came on the heels of an IPCC report that warned of significant environmental, economic, and health consequences in the absence of any serious momentum toward decarbonization by 2030."
The doctors note that continuing abortions – some of which are likely to develop complications – place greater stress on a healthcare system that is under tremendous pressure at the current time.,"['tremendous', 'pressure']",yes,The doctors note that continuing abortions – some of which are likely to develop complications – place greater stress on a healthcare system that is currently facing significant challenges.
"And while states like Massachusetts—among others—automatically cancel debt if a borrower dies or becomes disabled, New Jersey has chosen a different path, encouraging students to buy life insurance to cover their debt and take co-signers off the hook in the event of a tragedy",[],no,"And while states like Massachusetts—among others—automatically cancel debt if a borrower dies or becomes disabled, New Jersey has chosen a different path, encouraging students to buy life insurance to cover their debt and take co-signers off the hook in the event of a tragedy"
"Trump, who has been critical of the Iraq war, in a tweet called Powell “a real stiff.” Powell is the latest former top military officer to rebuke Trump in the wake of sweeping mass protests aimed at fighting racial injustice spurred by the May 25 death of an unarmed black man in Minnesota.",['rebuke'],yes,"Trump, who has been critical of the Iraq war, in a tweet called Powell “a real stiff.” Powell is the latest former top military officer to criticize Trump in the wake of sweeping mass protests aimed at fighting racial injustice spurred by the May 25 death of an unarmed black man in Minnesota."
"In a September executive order, President Donald Trump gave states and local governments the right to reject refugees, but instead of saying no, most state and local officials have blindsided the administration by opting in, according to two former officials familiar with the matter.",['blindsided'],yes,"In a September executive order, President Donald Trump gave states and local governments the right to reject refugees, but instead of saying no, most state and local officials have surprised the administration by opting in, according to two former officials familiar with the matter."
"This group is small but vocal, and represents a predictable if threatening merging of forces.",['threatening'],yes,"This group is small but vocal, and represents a predictable merging of forces."
"Trump likes to tell this story with vivid and completely made-up details about swaddling a baby in blankets before murdering it. The Senate held hearings in which anti-choice activist Jill Stanek — a crazed, racist liar who also claims Chinese people think aborted fetuses are a “delicacy” — claimed, almost certainly falsely, that she once witnessed a baby being killed this way.","['made-up', 'murdering', 'crazed', 'racist', 'liar', 'delicacy', 'anti-choice']",yes,"Trump likes to tell this story with exaggerated details about swaddling a baby in blankets before ending its life. The Senate held hearings in which activist Jill Stanek — who also made controversial claims about Chinese people’s views on aborted fetuses — claimed, almost certainly falsely, that she once witnessed a baby being killed this way."
"Americans Need To Stop Hurrying Young People Into Student Debt Slavery. Above all, we must give high schoolers personalized post-secondary educational recommendations before they get caught in the quagmire of student debt.","['Slavery', 'quagmire']",yes,"Americans need to stop rushing young people into student debt. Above all, we must provide high schoolers with personalized post-secondary educational recommendations before they become burdened by student debt."
"When it comes to the Green New Deal blueprint to address the climate crisis, Republicans generally like to pretend it calls for the elimination of hamburgers.",['pretend'],yes,"When it comes to the Green New Deal blueprint to address the climate crisis, Republicans often claim it calls for the elimination of hamburgers."
"The whole anti-vaxx (as it became known) thing was nuts, a way for fading celebrities to pretend to be the vanguard of a Great Cause that Saved The Children from a sinister government conspiracy.","['fading', 'sinister', 'conspiracy', 'nuts']",yes,The whole anti-vaxx (as it became known) movement was a way for some celebrities to present themselves as leaders of a cause aimed at protecting children from government interference.
"It was not stingy family leave policies that had this baby killed, it was the child’s mother, encouraged and enabled by a culture and legal regime that regard babies as a capstone consumer commodity to be ordered up when convenient, and violently disposed of when inconvenient.","['stingy', 'violently', 'disposed', 'killed', 'commodity']",yes,"It was not inadequate family leave policies that led to this baby's death, but the actions of the child’s mother, influenced by a culture and legal system that view babies as a convenience to be brought into the world when desired and discarded when not."
"President Donald Trump has characterized those clashing with law enforcement after George Floyd’s death under the knee of a Minneapolis police officer as organized, radical-left thugs engaging in domestic terrorism, an assertion repeated by Attorney General William Barr.","['radical-left', 'thugs', 'terrorism', 'domestic']",yes,"President Donald Trump has characterized those clashing with law enforcement after George Floyd’s death under the knee of a Minneapolis police officer as organized groups engaging in violent actions, an assertion repeated by Attorney General William Barr."
But opponents argued that asking minors to negotiate the legal system when they are already scared and ashamed could drive them to illegal abortions.,"['scared', 'ashamed']",yes,But opponents argued that asking minors to navigate the legal system when they may already feel vulnerable and distressed could drive them to illegal abortions.
"The words and notions of all these documents (Green New Deal, Venezuelan Constitution, UN Covenant “International Covenant on Economic, Social and Cultural Rights”, Stalin-written Soviet Constitution) may sound good to some, but in the end, they are just empty words at best, a siren call for the naïve, beckoning them to a socialist utopia, and at worst, lip service meant to distract from totalitarian brutality.","['empty', 'naïve', 'totalitarian', 'utopia', 'lip', 'service', 'brutality', 'siren', 'call', 'words']",yes,"The ideas and principles outlined in these documents (Green New Deal, Venezuelan Constitution, UN Covenant “International Covenant on Economic, Social and Cultural Rights”, Soviet Constitution) may seem appealing to some, but they are viewed by others as unrealistic or impractical, and potentially a distraction from more pressing political issues."
"I get that the media really want to do some bullcrap horse-race point-scoring partisan sniping right now. But these are actually important questions. And “gotcha” reporting may get you butt-slapped by your fellow reporters at the bar, but it’s actually really dangerous.","['bullcrap', 'butt-slapped', 'partisan', 'sniping', 'gotcha', 'dangerous', 'horse-race', 'point-scoring']",yes,"I understand that some media outlets are focusing on partisan arguments and competitive reporting right now. However, these are important issues, and sensationalized reporting may generate short-term attention but could have long-term negative consequences."
"Despite a pandemic, one-sided presidential nomination contests, and nationwide protests about police violence and racial equality, the primaries were important — and instructive.",['one-sided'],yes,"Despite a pandemic, competitive presidential nomination contests, and nationwide protests about police violence and racial equality, the primaries were important — and instructive."
The Georgia Democrats took wire hangers and bottles of bleach to the House floor in protest as symbols of the self-induced abortions that many desperate women dangerously attempt when the aid of a doctor isn’t available or allowed.,"['dangerously', 'desperate']",yes,The Georgia Democrats took wire hangers and bottles of bleach to the House floor in protest as symbols of self-induced abortions that many women attempt when the aid of a doctor isn’t available or allowed.
"The government of the secretive central Asian nation Turkmenistan published photos of what it claimed to be thousands of cyclists celebrating World Health Day on Tuesday with a crowded ride through the nation’s capital, Ashgabat – one of several sporting events seemingly held with no concern for the Chinese coronavirus.",['secretive'],yes,"The government of the central Asian nation Turkmenistan published photos of what it claimed to be thousands of cyclists celebrating World Health Day on Tuesday with a crowded ride through the nation’s capital, Ashgabat – one of several sporting events seemingly held with no concern for the Chinese coronavirus."
Transgender MMA fighter Fallon Fox twice broke a female opponent’s skull to win matches and now he is being praised by some in the LGBT community.,['praised'],yes,Transgender MMA fighter Fallon Fox twice broke a female opponent’s skull to win matches and now he is being acknowledged by some in the LGBT community.
"The Bezos Earth Fund may help shepherd along some new technologies, but billionaire philanthropy will not alter the regulatory structure that created the problem in the first place.","['billionaire', 'philanthropy']",yes,"The Bezos Earth Fund may help support some new technologies, but private funding will not alter the regulatory structure that created the problem in the first place."
"Much of this health hazard lies at the feet of folks like RFK Jr., so the idea that Trump was doing the anti-vax slow-jam with this quack a week before Inauguration Day understandably put Twitterverse over the edge","['anti-vax', 'slow-jam', 'quack']",yes,"Much of this health hazard is attributed to individuals like RFK Jr., so the idea that Trump was associating with this figure a week before Inauguration Day understandably caused a strong reaction on Twitter."
"That meant anyone walking into a branch with a certain level of assets instantly became a target for multiple offers. Customers with lower incomes were less of a priority, increasingly treated as little more than a source of fee harvesting.","['fee', 'harvesting']",yes,"That meant anyone walking into a branch with a certain level of assets instantly became a target for multiple offers. Customers with lower incomes were less of a priority, increasingly treated as a source of additional charges."
"Corinthian College Inc. is the bankrupted and criminal organization that Marco Rubio was defending just this past year, probably because he got a boatload of money from them in campaign organizations. Over the past 10 years it has come to light—through numerous lawsuits and state and federal investigations—that untold billions of dollars has been swindled out of student and taxpayers’ pockets by this private educational company.","['criminal', 'swindled', 'boatload']",yes,"Corinthian College Inc. is the bankrupt organization that Marco Rubio was defending just this past year, likely due to significant financial support from them in campaign organizations. Over the past 10 years it has come to light—through numerous lawsuits and state and federal investigations—that billions of dollars have been misappropriated from students and taxpayers by this private educational company."
"Home Secretary Priti Patel said that in response to the surge of illegal migrants, the government will look into how to speed up the deportation process, possibly to be modelled on Australia’s uncompromising system which saw a steep decline in illegal migration under the Commonwealth’s “stop the boats” policy.","['illegal', 'uncompromising']",yes,"Home Secretary Priti Patel said that in response to the surge of undocumented migrants, the government will look into how to speed up the deportation process, possibly to be modelled on Australia’s strict system which saw a steep decline in unauthorized migration under the Commonwealth’s “stop the boats” policy."
"President Donald Trump in an interview on Tuesday mocked former Vice President Joe Biden for continuing to wear a mask. The president pointed to a speech that Biden gave on Tuesday about race relations, where the former vice president removed his mask.",['mocked'],yes,"President Donald Trump in an interview on Tuesday criticized former Vice President Joe Biden for continuing to wear a mask. The president pointed to a speech that Biden gave on Tuesday about race relations, where the former vice president removed his mask."
"Her plight, along with those of about 27,000 DACA recipients working as doctors, nurses, paramedics and other health care workers, is full of irony: when the nation needs her most, she could be pulled from the workforce.",['irony'],yes,"Her plight, along with those of about 27,000 DACA recipients working as doctors, nurses, paramedics, and other health care workers, highlights a challenging situation: when the nation needs her most, she could be pulled from the workforce."
"When the men’s basketball Final Four tips off Saturday in Minneapolis, the NCAA’s biggest and most lucrative event will proceed as it normally does: the athletes on the floor for Virginia and Auburn, Michigan State and Texas Tech, will play games that generate hundreds of millions of dollars in total revenue for their schools, the NCAA and broadcast companies, the coaches and athletic directors, TV executives and NCAA suits will share in the riches but athletes themselves still won’t receive their fair share ― and thanks to a recent federal court decision, that won’t change in the immediate future.","['share', 'riches']",yes,"When the men’s basketball Final Four tips off Saturday in Minneapolis, the NCAA’s biggest and most lucrative event will proceed as it normally does: the athletes on the floor for Virginia and Auburn, Michigan State and Texas Tech, will play games that generate hundreds of millions of dollars in total revenue for their schools, the NCAA and broadcast companies, the coaches and athletic directors, TV executives and NCAA officials will benefit, but athletes themselves will still not receive appropriate compensation ― and thanks to a recent federal court decision, that won’t change in the immediate future."
"Pope Francis issued a severe indictment Wednesday of humanity’s failure to care for the planet, as environmentalists commemorate the 50th anniversary of “Earth Day.”","['indictment', 'severe']",yes,"Pope Francis issued a strong criticism Wednesday of humanity’s failure to care for the planet, as environmentalists commemorate the 50th anniversary of “Earth Day.”"
"It’s only a matter of time, the argument goes, before the Roe v. Wade precedent is struck down at the hands of five conservative justices, two of whom are on the high court thanks to Trump.","['struck', 'down', 'thanks']",yes,"It’s only a matter of time, the argument goes, before the Roe v. Wade precedent is overturned by five conservative justices, two of whom were appointed by Trump."
"Here’s an irony: Thanks to Roe, America is a whiter place than it would otherwise have become. If pro-lifers had had their way, on the other hand, America would be considerably blacker and browner than it is today.","['whiter', 'blacker', 'browner', 'irony', 'considerably', 'pro-lifers']",yes,"Here's an interesting point: Thanks to Roe, America's demographics are different than they would have been. If those opposed to abortion had had their way, the racial composition of America would likely have been different as well."
"In an article posted by NBC News on Monday, the AP argues that even erstwhile allies, like tennis great and gay activist Martina Navratilova, can become resentful of transgender women dominating their sport.",['allies'],yes,"In an article posted by NBC News on Monday, the AP argues that even former supporters, like tennis great and gay activist Martina Navratilova, can become resentful of transgender women dominating their sport."
"A report by the United Nations (UN) falsely blamed President Trump for the detention of 100,000 migrant children who, in fact, were held in federal immigration custody in 2015 by President Obama.","['blamed', 'falsely']",yes,"A report by the United Nations (UN) inaccurately attributed responsibility to President Trump for the detention of 100,000 migrant children, who were actually held in federal immigration custody in 2015 by President Obama."
Hotez said anti-vaccine groups are seizing on the anti-government sentiment stoked by conservative-leaning protesters to advance their cause.,"['stoked', 'anti-government']",yes,Hotez said anti-vaccine groups are capitalizing on the sentiment expressed by conservative-leaning protesters to advance their cause.
House Republicans are gearing up for a sustained push to expose leftist Democrats in the House Democrat majority on their increasingly extreme views on abortion.,['extreme'],yes,House Republicans are gearing up for a sustained push to highlight leftist Democrats in the House Democrat majority on their increasingly divergent views on abortion.
"If task force candidates from these organizations were absolute non-starters for presumptive presidential nominee Joe Biden, because they want to treat people who have committed crimes with too much human dignity, Sanders could instead have turned to an array of “progressive prosecutors.”","['progressive', 'prosecutors']",yes,"If task force candidates from these organizations were non-starters for presumptive presidential nominee Joe Biden, because they want to treat people who have committed crimes with more human dignity, Sanders could instead have turned to an array of reform-minded district attorneys."
"Bennett is seen immediately unleashing a tirade against Pan as he walks beside the politician, who tries to ignore, then laugh off his antagonist.","['tirade', 'unleashing']",yes,"Bennett is seen immediately criticizing Pan as he walks beside the politician, who tries to ignore, then laugh off his opponent."
Most of the Democratic presidential candidates have prioritized tackling the nation’s staggering student debt crisis and many have called for some form of debt forgiveness.,['staggering'],yes,Most of the Democratic presidential candidates have prioritized tackling the nation’s significant student debt issue and many have called for some form of debt forgiveness.
"The Trump administration gave the Border Patrol unchallengeable authority over migrants seeking asylum by invoking a little-known power given to the Centers for Disease Control and Prevention, the U.S. public health agency, to ban the entry of people or things that might spread “infectious disease” in the U.S.","['unchallengeable', 'authority']",yes,"The Trump administration gave the Border Patrol broad authority over migrants seeking asylum by invoking a little-known power given to the Centers for Disease Control and Prevention, the U.S. public health agency, to ban the entry of people or things that might spread “infectious disease” in the U.S."
CNN national correspondent John King ripped President Donald Trump for not mentioning climate change in his second State of the Union address.,['ripped'],yes,CNN national correspondent John King criticized President Donald Trump for not mentioning climate change in his second State of the Union address.
"The false messages that they say convinced hundreds of New Yorkers not to vaccinate their children weren’t spread in a Facebook group or on YouTube, but through a glossy magazine written by and for Orthodox Jewish parents.","['glossy', 'Orthodox', 'Jewish', 'false', 'messages']",yes,"The misleading information that they say convinced hundreds of New Yorkers not to vaccinate their children wasn’t spread in a Facebook group or on YouTube, but through a magazine written by and for parents in the Orthodox Jewish community."
"Last week, the House Judiciary Committee moved forward with plans for an expansive investigation into Trump World abuses, prompting White House Press Secretary Sarah Huckabee Sanders to release a rather intemperate press statement.","['abuses', 'intemperate']",yes,"Last week, the House Judiciary Committee moved forward with plans for an expansive investigation into issues related to Trump World, prompting White House Press Secretary Sarah Huckabee Sanders to release a strongly worded press statement."
"President Donald Trump in an interview on Wednesday ripped former Vice President Joe Biden for failing on race relations, after 43 years in public office.","['ripped', 'failing']",yes,"President Donald Trump in an interview on Wednesday criticized former Vice President Joe Biden for his handling of race relations, after 43 years in public office."
"On Wednesday, democrats got a chance to grill President Donald Trump's point person on deregulation as Andrew Wheeler came to Capitol Hill for his confirmation hearing to be the next permanent administrator of the Environmental Protection Agency.",['grill'],yes,"On Wednesday, Democrats had the opportunity to question President Donald Trump's point person on deregulation as Andrew Wheeler came to Capitol Hill for his confirmation hearing to be the next permanent administrator of the Environmental Protection Agency."
"For most of his presidency, the Republican has demanded sharp cuts to legal immigration, and has made this a non-negotiable element of any deal.","['demanded', 'non-negotiable']",yes,"For most of his presidency, the Republican has called for significant cuts to legal immigration, making it a key condition in any deal."
"They came to the United States from all corners of the globe -- Somalia, Rwanda, El Salvador, the Balkans, Germany, Iraq -- claiming to have been persecuted but, in reality, they were the persecutors.","['persecuted', 'persecutors']",yes,"They came to the United States from various regions of the world -- Somalia, Rwanda, El Salvador, the Balkans, Germany, Iraq -- claiming to have faced persecution but, in fact, were involved in acts of persecution."
"Restrictions to health care organizations that work on family planning as known as the global gag rule does extensive harm to women, especially in developing countries, but it’s nevertheless been embraced by every recent Republican administration.","['embraced', 'extensive', 'harm']",yes,"Restrictions on health care organizations that work on family planning, known as the global gag rule, have significant negative impacts on women, especially in developing countries, but it has been supported by every recent Republican administration."
"Trump is “angry” that intelligence officials informed Sanders and other members of Congress about some of Russia’s meddling efforts in the 2020 election cycle, Biden said, adding that the administration must do more to secure the integrity of our elections.",['angry'],yes,"Trump is upset that intelligence officials informed Sanders and other members of Congress about some of Russia’s meddling efforts in the 2020 election cycle, Biden said, adding that the administration must do more to secure the integrity of our elections."
"For some years now, conservative and libertarian education policy experts have warned against voucher systems in favor, instead, of tax-credit scholarships and education savings accounts, which are less likely to drag the regulations and mandates of government schools into the private arena.",['drag'],yes,"For some years now, conservative and libertarian education policy experts have warned against voucher systems in favor, instead, of tax-credit scholarships and education savings accounts, which are less likely to involve the regulations and mandates of government schools in the private sector."
Proponents of stricter protections for students argue the DOE’s recent rollback of Obama-era rules aimed at protecting students from predatory for-profit colleges will only lead to even more student defaulting on their loans.,['predatory'],yes,Proponents of stricter protections for students argue the DOE’s recent rollback of Obama-era rules aimed at protecting students from exploitative for-profit colleges will only lead to even more student defaulting on their loans.
