biased_sentence,biased_words,rephrase_possible,debiased_sentence
"But if you major in philosophy or gender studies, you might struggle to find any job in your field, let alone a well-paying one.",['struggle'],yes,"But if you major in philosophy or gender studies, you might find it challenging to secure a job in your field, let alone a well-paying one."
Inhibiting travel and commerce—not to mention making consular interviews deeply intrusive on a gendered basis—by imposing restrictions on pregnant women is an alarmist reaction to a small issue.,"['intrusive', 'alarmist']",yes,Inhibiting travel and commerce—and making consular interviews more difficult for pregnant women—by imposing restrictions is an exaggerated reaction to a minor issue.
"Major League Baseball is using its financial muscle to support the U.S. women's softball team, which already is assured a spot in the Tokyo Olympics while the American men's baseball team struggles to qualify.","['financial', 'muscle', 'struggles']",yes,"Major League Baseball is using its resources to support the U.S. women's softball team, which has already secured a spot in the Tokyo Olympics, while the American men's baseball team faces challenges in qualifying."
"People from populations targeted by these immigration policies might also experience more discrimination, which worsens mental health.",['worsens'],yes,"People from populations targeted by these immigration policies might also experience more discrimination, which negatively impacts mental health."
Six Republican Senators have failed to develop a coalition for their plan that exchanges a fifth of border wall funding for an amnesty for illegal aliens and increased immigration.,"['illegal', 'aliens', 'failed']",yes,Six Republican Senators have struggled to develop a coalition for their plan that exchanges a fifth of border wall funding for a pathway to citizenship for undocumented immigrants and increased immigration.
"Biden made the apocalyptic pronouncement while discussing climate change before a crowd of supporters in Peterborough, New Hampshire.",['apocalyptic'],yes,"Biden made the urgent pronouncement while discussing climate change before a crowd of supporters in Peterborough, New Hampshire."
"There may be pushback among Democrats. If so, I hope the ones doing the pushing will reconsider. We have treated our younger generations, and many older people, unjustly. The act of recognizing an injustice we hadn’t seen before makes us more human and refines us as moral beings.","['moral', 'unjustly', 'injustice', 'human']",yes,"There may be pushback among Democrats. If so, I hope the ones doing the pushing will reconsider. We have treated our younger generations, and many older people, unfairly. Recognizing an issue we hadn’t seen before helps us grow as individuals and improves our ethical understanding."
"But Americans who blame anti-vaccination parents and propaganda have it wrong. Yes, those who do not vaccinate their children play a role in our failing rates, and lies about vaccinations causing autism have made matters worse, but there are less known, more significant causes to poor completion rates in children.","['anti-vaccination', 'lies', 'propaganda', 'wrong']",yes,"But Americans who blame parents who refuse to vaccinate and misinformation have it incorrect. Yes, those who do not vaccinate their children contribute to the declining rates, and false claims about vaccinations causing autism have made matters worse, but there are lesser-known, more significant factors affecting poor vaccination completion rates in children."
"Parent borrowing is a sacrifice many black parents make to pay for their children’s college education, and it is especially prevalent among families whose children attend historically black colleges and universities.","['sacrifice', 'black']",yes,"Parent borrowing is a common practice for many parents to pay for their children’s college education, and it is especially prevalent among families whose children attend historically black colleges and universities."
"This idea, gaining traction under the hashtag #CancelStudentDebt following the release of Sanders’ college debt forgiveness plan, is bad for several reasons, but naturally appealing in a sort of populist way, since plenty of people choose not to think about second-order impacts and potential consequences of driving our country into even more ruinous national debt than before.","['bad', 'naturally', 'appealing', 'ruinous']",yes,"This idea, gaining traction under the hashtag #CancelStudentDebt following the release of Sanders’ college debt forgiveness plan, has several potential drawbacks, but it is appealing in a populist way, as many people choose not to consider the second-order impacts and potential consequences of increasing national debt."
"Trump reportedly told advisers during a “contentious” meeting on Monday that he wanted to deploy as many as 10,000 National Guard troops to D.C., Reuters reported. But Defense Secretary Mark Esper, Chairman of the Joint Chiefs of Staff Mark Milley and Attorney General William Barr reportedly pushed back.",['contentious'],yes,"Trump reportedly told advisers during a tense meeting on Monday that he wanted to deploy as many as 10,000 National Guard troops to D.C., Reuters reported. But Defense Secretary Mark Esper, Chairman of the Joint Chiefs of Staff Mark Milley and Attorney General William Barr reportedly pushed back."
Actor and climate change activist Joaquin Phoenix was spotted at Oscars Party with plastic water bottle after climate change rant.,"['climate', 'change', 'rant']",yes,Actor and environmental activist Joaquin Phoenix was spotted at an Oscars party with a plastic water bottle after discussing the issue of climate change.
Practicing pro-life litigators know that Trump judges are saving lives by permitting restrictions on abortion to go into effect.,"['pro-life', 'saving']",yes,"Practicing litigators believe that Trump-appointed judges are allowing restrictions on abortion to go into effect, which they argue will impact abortion access."
"But even after contracting a life-threatening infection that might have been prevented by a vaccine, his family stood firm on their anti-vax stance.",['anti-vax'],yes,"But even after contracting a life-threatening infection that might have been prevented by a vaccine, his family maintained their stance against vaccination."
"Next came the sob stories. Those student loans are suffocating a generation, the candidates suggested. After all, “40 million of us who can’t start a family,” the diaper-changing daddy Swalwell contradictorily proclaimed, adding that they “Can’t take a good idea and start a business and can’t buy our first home.”","['sob', 'stories', 'diaper-changing', 'daddy', 'suffocating', 'contradictorily']",yes,"Next came the personal anecdotes. The candidates suggested that student loans are a significant burden for a generation. As one candidate mentioned, ""40 million of us can't start a family,"" adding that they ""can't take a good idea and start a business or buy our first home."""
"For those who think this country needs baseball now to raise its depressed spirits, you might consider a cautionary historical precedent, the Summer of Swat of 1998.","['depressed', 'cautionary']",yes,"For those who think this country needs baseball now to uplift its spirits, you might consider a historical precedent, the Summer of Swat of 1998."
"As a political calculation, it shows Biden’s campaign is confident about their standing with many suburban moderates who were swing voters in the past but have moved solidly into the Democratic Party during Trump’s presidency, offended by his bullying demeanor and chaotic style.","['chaotic', 'style', 'bullying', 'demeanor']",yes,"As a political calculation, it shows Biden’s campaign is confident about their standing with many suburban moderates who were swing voters in the past but have moved solidly into the Democratic Party during Trump’s presidency, troubled by his approach and leadership style"
"For our friends on the Left, Trump’s refusal to wear a mask is irresponsible toxic masculinity that is sending the wrong message and getting people killed, even though Dr. Deborah Brix has explained it’s not much of a risk. Biden, meanwhile, to their minds is leading by example by wearing his mask even when there is no good reason he should.","['irresponsible', 'toxic', 'masculinity', 'wrong']",yes,"For our friends on the Left, Trump’s refusal to wear a mask is seen as sending the wrong message and potentially contributing to harm, even though Dr. Deborah Brix has explained it’s not much of a risk. Biden, meanwhile, is viewed as leading by example by wearing his mask even when it may not be necessary."
"But there’s also an intensifying global climate crisis, which carries life-changing risks for billions of people.","['intensifying', 'life-changing']",yes,"But there’s also a growing global climate crisis, which carries significant risks for billions of people."
"It’s a trap because a college education doesn’t guarantee a good job. For years, the return on investment for higher education has steadily declined. More than 40 percent of recent college graduates are underemployed and work in jobs that do not require a college education.",['trap'],yes,"It’s a challenge because a college education doesn’t guarantee a good job. For years, the return on investment for higher education has steadily declined. More than 40 percent of recent college graduates are underemployed and work in jobs that do not require a college education."
"Other than the fact that none of the above is even close to the truth and that the entire premise of the article is the fakest of fake news, the Daily Beast has a real bombshell on its hands.","['of', 'fake', 'news', 'truth', 'bombshell', 'fakest']",yes,"Other than the fact that none of the above is accurate and that the entire premise of the article is misleading, the Daily Beast has a significant story on its hands."
A slew of other world leaders and senior officials lined up to express their dismay over what they said was Trump's willingness to hamper the WHO just when the world needs it the most.,"['hamper', 'dismay', 'willingness']",yes,A number of other world leaders and senior officials expressed concern over what they described as Trump's actions potentially affecting the WHO just when the world needs it the most.
"Since the start of the coronavirus outbreak, Trump has hampered efforts to slow the virus’s spread and encouraged Americans’ restlessness under quarantine.","['hampered', 'restlessness']",yes,"Since the start of the coronavirus outbreak, Trump has hindered efforts to slow the virus’s spread and contributed to Americans’ frustration under quarantine."
This would be the same Taliban that gleefully murders young women for the crime of going to school and regards democracy as a crime against Islam punishable by death.,"['gleefully', 'murders', 'democracy', 'crime']",yes,This would be the same Taliban that opposes young women attending school and considers democracy incompatible with their interpretation of Islam.
"But Trump and his most ardent supporters seem almost physically repulsed at the very idea of wearing a mask. One Republican Ohio state legislator even claimed that since “we are all created in the image and likeness of God,” covering the face with a mask is an affront to God’s creation.","['repulsed', 'affront', 'to', 'God’s', 'creation']",yes,"But Trump and some of his supporters appear strongly opposed to the idea of wearing a mask. One Republican Ohio state legislator even argued that since ""we are all created in the image and likeness of God,"" covering the face with a mask contradicts the natural design."
"The man-made Amazon fires are for clearing the land of its forests and indigenous people. The benefits are for Jair Bolsonaro’s cronies, while producing a climate disaster for the world.","['cronies', 'climate', 'disaster']",yes,"The man-made Amazon fires are aimed at clearing land for development, affecting forests and indigenous communities. The benefits largely favor Jair Bolsonaro’s allies, while contributing to significant environmental challenges globally."
"Nevertheless, the media jihad continues, and that includes NBC shamelessly running a debunked and deceptive smear story that had been reported on and debunked all the way back in May.","['shamelessly', 'debunked', 'deceptive', 'smear', 'story', 'jihad', 'media']",yes,"Nevertheless, the media coverage continues, and that includes NBC running a story that had previously been reviewed and found to be inaccurate, dating back to May."
Tlaib charged that Israel is using U.S. funding to further its goal of an ethno-supremacist state.,['ethno-supremacist'],yes,Tlaib charged that Israel is using U.S. funding to further its goal of a state based on ethnic dominance.
"Of course, billionaires and corporations that reaped millions of dollars from the GOP tax cuts pumped some of that windfall into Republican campaigns, allowing Sen. Mitch McConnell, R-Ky., to retain control of the Senate.","['reaped', 'of', 'pumped']",yes,"Of course, billionaires and corporations that gained millions of dollars from the GOP tax cuts invested some of that windfall into Republican campaigns, helping Sen. Mitch McConnell, R-Ky., retain control of the Senate."
"The Christian Right, white nationalists and coronavirus truthers are so twisted that they have even turned Dr. Anthony Fauci into one of the objects of their hatred. Fauci, an expert immunologist who is part of Trump’s coronavirus task force, has had to increase his security detail because of death threats from extremists who believe he is exaggerating the threat in order to undermine Trump’s presidency.","['twisted', 'hatred', 'truthers', 'extremists', 'coronavirus']",yes,"The Christian Right, some white nationalists, and individuals skeptical of the coronavirus have targeted Dr. Anthony Fauci, a renowned immunologist and member of Trump’s coronavirus task force. Fauci has had to increase his security detail due to threats from individuals who believe he is overstating the threat in order to undermine Trump’s presidency."
"Until the last few years, all Washington could talk about was how to cut Social Security benefits, and by how much but a grass-roots progressive coalition began campaigning for expansion in 2013, and the idea has since moved straight to the heart of the Democratic Party.",[],yes,"Until the last few years, Washington primarily focused on discussions about reducing Social Security benefits. However, a grass-roots progressive coalition began advocating for expansion in 2013, and this idea has since gained significant support within the Democratic Party."
"For Fox, Clinton, Omar, and Ocasio-Cortez represent perfect targets in terms of riling up its intolerant base: Clinton is a woman of a certain age, while Ocasio-Cortez and Omar are women of a certain heritage.","['riling', 'intolerant', 'certain']",yes,"For Fox, Clinton, Omar, and Ocasio-Cortez are figures that draw significant attention: Clinton is an older woman, while Ocasio-Cortez and Omar represent women from diverse backgrounds."
"Today’s mainstream media doesn’t want you to remember, but the early days of feminism were rife with ideological battles and  backstabbing that would put a medieval court to shame.","['to', 'remember', 'rife', 'backstabbing', 'mainstream', 'media', 'ideological', 'battles']",yes,"Today’s media may not highlight it, but the early days of feminism were marked by internal conflicts and disagreements that were intense and divisive."
"A bold statement Wednesday from former Secretary of Defense Gen. James Mattis eviscerating Donald Trump has landed like a bomb in the Senate Republican caucus, sending members fleeing in all different directions.","['eviscerating', 'bomb', 'bold']",yes,"A strong statement Wednesday from former Secretary of Defense Gen. James Mattis criticizing Donald Trump has made a significant impact in the Senate Republican caucus, causing members to react in various ways."
The justices threw out a challenge from gun rights groups.,[],no,The justices threw out a challenge from gun rights groups.
The Trump administration shelved a document created by the nation's top disease investigators with step-by-step advice to local authorities on how and when to reopen restaurants and other public places during the still-raging coronavirus outbreak,['shelved'],yes,The Trump administration postponed a document created by the nation's top disease investigators with step-by-step advice to local authorities on how and when to reopen restaurants and other public places during the ongoing coronavirus outbreak.
"Apparently, even many people within the gun rights movement are concerned and are working to prevent people from openly bringing weapons to the rally but with leaders like Tucker Carlson and Donald Trump rooting them on, the “good people” who will descend on Richmond on January 20 may feel like they have approval to light a spark.","['rooting', 'good', 'people']",yes,"Apparently, even many people within the gun rights movement are concerned and are working to prevent people from openly bringing weapons to the rally, but with leaders like Tucker Carlson and Donald Trump supporting them, those attending the Richmond rally on January 20 may feel encouraged to take action."
It was at this point that Trump thought it’d be a good idea to start bragging.,"['good', 'bragging']",yes,It was at this point that Trump decided to highlight his achievements.
"More subtly, however, Pelosi is also using her gender to put Trump — who is visibly unnerved by having any woman around that isn’t clearly there to serve him, sexually or otherwise — on his heels.","['gender', 'visibly', 'unnerved', 'subtly', 'serve', 'sexually']",yes,"More tactfully, however, Pelosi is using her position to challenge Trump — who seems uncomfortable when interacting with women who are not in roles he perceives as subordinate — and put him on the defensive."
"India’s Prime Minister Narendra Modi is often compared to Donald Trump, especially when it comes to his anti-Muslim policies.",['anti-Muslim'],yes,"India’s Prime Minister Narendra Modi is often compared to Donald Trump, especially with regard to his policies toward religious minorities."
"Carmen Lodato wears a pin with her mother’s face — a reminder of the heart-wrenching murder six years ago in Alexandria, Va., that got her into the fight for gun control.","['heart-wrenching', 'gun', 'control']",yes,"Carmen Lodato wears a pin with her mother’s face — a reminder of the tragic murder six years ago in Alexandria, Va., that motivated her involvement in advocating for gun safety measures."
"Palmer had been using the power of deputization to create a private armed force comprised of his political supporters—and he gave them tremendous powers, including the ability to harass his enemies.","['tremendous', 'harass', 'enemies', 'power', 'armed', 'force', 'private']",yes,"Palmer had been using deputization to form a group of his political supporters and granted them significant authority, including the ability to intimidate his opponents."
"The tragedy of America’s 18 years in Afghanistan has been a stubborn refusal to admit the Afghan government is incapable of standing on its own, no matter how much money is poured into it, how much training its troops are given, or how many of its battles American soldiers fight.","['stubborn', 'incapable', 'tragedy']",yes,"The challenges of America’s 18 years in Afghanistan have been marked by a reluctance to acknowledge the Afghan government’s struggles to stand on its own, despite the financial support, training provided to its troops, and the involvement of American soldiers in its battles."
"Sargent has written leftist pieces at the Washington Post for years. In March 2016, Sargent called then-candidate Donald Trump a “nightmare nominee,” saying that not even white men like Trump.","['nightmare', 'nominee', 'leftist']",yes,"Sargent has written articles with progressive viewpoints at the Washington Post for years. In March 2016, Sargent described then-candidate Donald Trump as a problematic nominee, stating that even some white men did not support Trump."
It remains to be seen how players — whose wages span a wide spectrum in a league with no salary cap — will respond to the request following calls from government ministers to cut their often-astronomical wages.,['often-astronomical'],yes,It remains to be seen how players — whose wages span a wide spectrum in a league with no salary cap — will respond to the request following calls from government ministers to reduce their high wages.
"But the timing made the mailer less of an attack than an argument in favor of Lewis George: It arrived in mailboxes as protests over police killings of Black people, including George Floyd in Minneapolis, broke out nationwide and sparked calls for massive overhauls of police departments across the country.",[],no,"But the timing made the mailer less of an attack than an argument in favor of Lewis George: It arrived in mailboxes as protests over police killings of Black people, including George Floyd in Minneapolis, broke out nationwide and sparked calls for reforms in police departments across the country."
Coronavirus vaccine and quarantine protesters in America form an unholy COVID-19 alliance. These groups have converged to spread the same dangerous and self-defeating message.,"['dangerous', 'self-defeating', 'unholy']",yes,Coronavirus vaccine and quarantine protesters in America have formed a COVID-19 alliance. These groups have converged to spread a message that is harmful and counterproductive.
"Although U.S.-based sporting goods companies now produce almost none of their own gear, increasing the cost of imports from China could still jeopardize thousands of U.S. white collar jobs in design, product development, and sales and marketing.",['jeopardize'],yes,"Although U.S.-based sporting goods companies now produce almost none of their own gear, increasing the cost of imports from China could still affect thousands of U.S. white collar jobs in design, product development, and sales and marketing."
"As leading 2020 Dems advocate spending big on the Green New Deal, it turns out most Americans are worried about other issues.",['big'],yes,"As leading 2020 Democrats advocate significant spending on the Green New Deal, it turns out most Americans are worried about other issues."
The specter of “abortion regret” has been used by lawmakers and judges alike to impose or uphold rules making it harder for people to get abortions.,"['abortion', 'regret', 'specter']",yes,"Concerns about ""regret"" have been used by lawmakers and judges alike to impose or uphold rules making it harder for people to access abortions."
But the national and global trends spin a tale of two separate realities. An irrational fear of vaccines among well-educated and largely white Americans has fueled an utterly preventable and dangerous disease that had been considered “eliminated” by scientists.,"['irrational', 'preventable', 'utterly']",yes,But the national and global trends highlight two separate realities. A fear of vaccines among well-educated and largely white Americans has contributed to a disease that was previously considered “eliminated” by scientists.
"China – the country that throws its minorities into concentration camps and uses them for slave labor, the brutal authoritarian regime driven by Han Chinese racial supremacist ideology, the government that thinks nothing of wiping out entire villages if it needs to build a few dams quickly to put on a good show for the Olympics – boasted of its superior compassion and tolerance in the pages of the CCP’s Global Times on Monday","['brutal', 'racial', 'supremacist', 'throws', 'superior']",yes,"China – a country where minorities face severe repression, with accusations of forced labor in camps and human rights abuses, and a government that has been criticized for its handling of development projects at the expense of local communities – boasted of its compassion and tolerance in the pages of the CCP’s Global Times on Monday."
"Reporting from Buzzfeed News Thursday evening exposed how President Donald Trump’s immigration policies led to four deaths and preventable surgeries for children held in the administration’s detention regime, including one eight-year-old boy whose forehead was partially removed.","['exposed', 'regime', 'detention']",yes,"Reporting from Buzzfeed News Thursday evening highlighted how President Donald Trump’s immigration policies led to four deaths and preventable surgeries for children held in the administration’s detention system, including one eight-year-old boy whose forehead was partially removed."
"In the seven years since, Warren has become the most active politician in America when it comes to investigating, transforming and eliminating student debt.",[],no,"In the seven years since, Warren has been highly involved in efforts related to investigating, transforming, and eliminating student debt."
