biased_sentence,biased_words,rephrase_possible,debiased_sentence
Conway recycled a right-wing talking point that falsely claims a bill designed to loosen certain restrictions on late-term abortions in Virginia is “infanticide” during her Monday appearance on “Outnumbered Overtime with Harris Faulkner.”,"['recycled', 'infanticide']",yes,Conway reiterated a talking point that inaccurately describes a bill designed to loosen certain restrictions on late-term abortions in Virginia as “infanticide” during her Monday appearance on “Outnumbered Overtime with Harris Faulkner.”
Anti-vaccine groups take dangerous online harassment into the real world,"['harassment', 'dangerous']",yes,Anti-vaccine groups take aggressive online actions into the real world.
Democrats have made it clear they will sandbag the people we’ve elected to govern if we refuse to vote for Democrats.,['sandbag'],yes,Democrats have made it clear they will obstruct the people we’ve elected to govern if we refuse to vote for Democrats.
China appears to be feeding off similar complaints from the left in the United States. Complaints about partisan “gridlock” are perennial and grow especially loud when Democrats and their highly sympathetic media are the ones complaining about Republicans getting in their way.,"['highly', 'sympathetic', 'feeding']",yes,China appears to be responding to similar complaints from the left in the United States. Complaints about partisan “gridlock” are perennial and grow especially loud when Democrats and their supportive media are the ones complaining about Republicans getting in their way.
"In Washington, three key issues seemed to galvanize most of the protesters: climate change, immigration and reproductive rights.",['galvanize'],yes,"In Washington, three key issues seemed to motivate most of the protesters: climate change, immigration, and reproductive rights."
"In practice, that means it's hard to trust Bezos' pledge when Amazon, the source of his wealth, has been aggressively courting oil and gas companies with its cloud computing services and threatened workers who campaigned for stronger climate action with dismissal.","['aggressively', 'courting', 'hard', 'to', 'trust', 'threatened']",yes,"In practice, that means it's difficult to fully accept Bezos' pledge when Amazon, the source of his wealth, has been engaging with oil and gas companies through its cloud computing services and warned workers who campaigned for stronger climate action about potential dismissal."
"There can be no serious discussion of this issue, however, in 60-second sound bites. So, beyond the soak-the-rich shtick that shades every Democratic economic debate point, the candidates resorted to two tactics: shock and sob stories.","['shock', 'and', 'sob', 'stories', 'shtick', 'shades', 'soak-the-rich']",yes,"There can be no serious discussion of this issue, however, in 60-second sound bites. Beyond the focus on wealth redistribution, the candidates resorted to two tactics: dramatic appeals and emotional narratives."
"Trump’s approval rating remains resilient at around 40%, with a large majority of Republicans still approving of his overall performance. But sustained pessimism among Trump’s supporters could portend potential weakness ahead of November’s election, when he will face Democratic former Vice President Joe Biden, experts said.",['resilient'],yes,"Trump’s approval rating remains steady at around 40%, with a large majority of Republicans still approving of his overall performance. But sustained pessimism among Trump’s supporters could indicate potential weakness ahead of November’s election, when he will face Democratic former Vice President Joe Biden, experts said."
"Smith’s announcement Sunday at the all-male, historically black college in Atlanta, Georgia provoked impassioned calls for both making higher education free across the country and canceling student debt.",['impassioned'],yes,"Smith’s announcement Sunday at the all-male, historically black college in Atlanta, Georgia provoked strong calls for both making higher education free across the country and canceling student debt."
Impeachment Is Just Another Word For Delusional Democrats Holding The Nation Hostage,['Delusional'],yes,"Impeachment is another term for Democrats opposing the current administration, holding the nation in a difficult situation."
Though  Alexandria Ocasio-Cortez was by no means the first to describe migrant detention centres as concentration camps — disgraced Arizona Sheriff Joe Arpaio boasted his “tent city” in the Sonora Desert was just that — her comments ignited a firestorm of controversy.,['firestorm'],yes,Though Alexandria Ocasio-Cortez was by no means the first to describe migrant detention centres as concentration camps — disgraced Arizona Sheriff Joe Arpaio boasted his “tent city” in the Sonora Desert was just that — her comments sparked significant controversy.
"For starters, Gautney, per her Twitter profile, is an associate professor of sociology at Fordham University, a private school located in New York City. None of this is a problem on its own; in a free society, people should be able to tweet whatever dumb things they want while working in whichever industry or field of research.",['dumb'],yes,"For starters, Gautney, per her Twitter profile, is an associate professor of sociology at Fordham University, a private school located in New York City. None of this is a problem on its own; in a free society, people should be able to tweet whatever opinions they want while working in whichever industry or field of research."
"For several years, climate change doomsayers have turned their attention to cattle, as a series of reports demonstrated that “livestock emissions” are more dangerous for the environment than automobiles.",['doomsayers'],yes,"For several years, climate change advocates have turned their attention to cattle, as a series of reports demonstrated that “livestock emissions” are more dangerous for the environment than automobiles."
"Unbelievably, with all they had seen their child suffer, his parents not only refused the doctor’s suggestion that he receive another DTaP vaccination they also declined all the other scheduled vaccinations the boy had missed.",['Unbelievably'],yes,"Despite witnessing their child suffer, his parents not only refused the doctor’s suggestion that he receive another DTaP vaccination, but they also declined all the other scheduled vaccinations the boy had missed."
"Yet it far better applies to unelected career bureaucrats’ use of their power to prosecute their political enemies, which comprises the heart of the “resistance” to Republican rule that will endure so long as bureaucracy has enough power to challenged elected branches of government. This bureacracy weaponization was also a hallmark of the Obama presidency, with — ironies of ironies — perhaps the biggest evidences again coming from the Department of Justice under attorneys general Eric Holder and Loretta Lynch.","['weaponization', 'ironies', 'of']",yes,"Yet it better applies to unelected career bureaucrats’ use of their power to prosecute their political opponents, which is at the core of the opposition to Republican rule that will persist as long as bureaucracy has enough power to challenge elected branches of government. This misuse of power was also evident during the Obama presidency, with perhaps the biggest examples again coming from the Department of Justice under attorneys general Eric Holder and Loretta Lynch."
"The president’s likely opponent in the November elections, Democrat Joe Biden, was not among those who were inspired. Instead, tone-deaf as he is to the American people and the things of the Spirit, he said the president’s appearance outside the church shows he “is more interested in power than in principle.”",['tone-deaf'],yes,"The president’s likely opponent in the November elections, Democrat Joe Biden, was not among those who were inspired. Instead, unaware of the American people's sentiments and the significance of the situation, he said the president’s appearance outside the church shows he “is more interested in power than in principle.”"
"During her acceptance speech for best actress in a limited television series for Fosse/Vernon, Williams went on a bizarre rant about the need for abortion rights in the United States and for American women to vote for pro-choice candidates during election years.","['bizarre', 'pro-choice', 'rant']",yes,"During her acceptance speech for best actress in a limited television series for Fosse/Vernon, Williams discussed the need for abortion rights in the United States and encouraged American women to vote for candidates who support reproductive rights during election years."
"The 2010s saw the U.S. economy achieve its longest-ever expansion, with notable milestones such as 110 months of uninterrupted job gains and an unemployment rate near a half-century low becoming easy bragging points for politicians and economists alike.","['bragging', 'notable']",yes,"The 2010s saw the U.S. economy achieve its longest-ever expansion, with milestones such as 110 months of uninterrupted job gains and an unemployment rate near a half-century low becoming significant points of discussion for politicians and economists alike."
"Student loan debt is no doubt a drag on the U.S. economy, holding back how much money young consumers can spend on cars, homes and even invest in 401(k) plans or new businesses.","['drag', 'no', 'doubt']",yes,"Student loan debt is a significant burden on the U.S. economy, limiting how much money young consumers can spend on cars, homes, and even invest in 401(k) plans or new businesses."
"Donald Trump announced at the time that the Environmental Protection Agency would be led, at least temporarily, by Andrew Wheeler – a former lobbyist for, among others, Murray Energy, one of the nation’s largest coal companies and former chief counsel for Sen. James Inhofe (R-Okla.), one of the nation’s preeminent climate deniers.","['preeminent', 'climate', 'deniers']",yes,"Donald Trump announced at the time that the Environmental Protection Agency would be led, at least temporarily, by Andrew Wheeler – a former lobbyist for, among others, Murray Energy, one of the nation’s largest coal companies and former chief counsel for Sen. James Inhofe (R-Okla.), who has been known for his skepticism about climate change."
It is a monumental ode to human stupidity that the wealthiest nation in the world teeters on the edge of a dangerous measles epidemic at the same time that poor nations are struggling to vaccinate their residents.,"['stupidity', 'monumental', 'ode', 'human']",yes,It is concerning that the wealthiest nation in the world faces the risk of a measles epidemic while poorer nations are struggling to vaccinate their residents.
"Protecting pregnant women, new mothers and children is about more than scoring political points with anti-choice legislation.","['scoring', 'anti-choice', 'political', 'points']",yes,"Protecting pregnant women, new mothers, and children involves more than advancing legislation that limits reproductive rights."
The failure to act to ameliorate global warming exposes the myth of human progress and the illusion that we are rational creatures.,"['myth', 'illusion']",yes,The failure to act to address global warming challenges the notion of continuous human progress and the assumption that we always act rationally.
"A protester could be seen throwing an object at Frey as he slinked away. Biden, so far, has enjoyed the luxury of remaining in his basement, hidden away from volatile activists who want answers.","['slinked', 'away', 'volatile', 'hidden', 'luxury', 'activists']",yes,"A protester could be seen throwing an object at Frey as he retreated. Biden, so far, has remained in his basement, avoiding protests from individuals seeking answers."
Phoenix’s Oscar speech for Joker was a rambling discourse that veered in several direction before settling on environmental platitudes.,"['rambling', 'veered', 'discourse']",yes,Phoenix’s Oscar speech for Joker covered several topics before concluding with environmental themes.
"Trump, who opted against giving a Super Bowl pregame interview last year, made several eyebrow-raising remarks during his interview with host Margaret Brennan, touching on topics including his plan to withdraw U.S. troops from Syria and whether he would let his 12-year-old son play football.",['eyebrow-raising'],yes,"Trump, who opted against giving a Super Bowl pregame interview last year, made several notable remarks during his interview with host Margaret Brennan, touching on topics including his plan to withdraw U.S. troops from Syria and whether he would let his 12-year-old son play football."
"Donald Trump, who was pro-choice in the not-too-distant past and never fit the mold of a far-right culture-war crusader, has taken a keen interest in abortion rights lately.","['far-right', 'crusader', 'pro-choice']",yes,"Donald Trump, who previously supported abortion rights and did not align with extreme right-wing positions, has recently taken a keen interest in abortion rights."
"According to Planned Parenthood office in Roanoke, Virginia, the abortion giant will continue to perform abortion services during the COVID-19 pandemic, claiming abortion is an “essential” medical service.","['abortion', 'essential']",yes,"According to the Planned Parenthood office in Roanoke, Virginia, the organization will continue to provide medical services, including abortion, during the COVID-19 pandemic, asserting that it is a necessary medical service."
"As banks leave low-income communities and jack up the cost of basic financial services such as checking accounts, many Americans instead have to rely on expensive and often predatory “fringe banking” institutions, such as check-cashing businesses, payday lenders and pawnshops.","['up', 'expensive', 'predatory', 'fringe', 'banking', 'jack']",yes,"As banks reduce their presence in low-income communities and increase the cost of basic financial services such as checking accounts, many Americans instead rely on alternative financial institutions, such as check-cashing businesses, payday lenders, and pawnshops."
"The “baby parts” debacle from a few years ago is another example of how the anti-choice movement is not a group sober-minded devout Christians who just love “life,” but in fact a bunch of fanatics who have contempt for the truth and think nothing of spinning wild stories and engaging in implausible thought-experiments in their efforts to smear feminists.","['spinning', 'fanatics', 'anti-choice', 'implausible']",yes,"The “baby parts” controversy from a few years ago is another example of how the anti-abortion movement is not just a group of devout Christians advocating for life, but rather a group that has been criticized for spreading misinformation and engaging in exaggerated claims to challenge feminist perspectives."
"Of all the pandering showcased during Democrats’ attempts to win back the presidency, wiping out student debt ranked at or near the top.",['pandering'],yes,"Of all the strategies used during Democrats’ attempts to win back the presidency, wiping out student debt ranked at or near the top."
"This would not be the first time Biden has been criticized for his ideas on combatting climate change, which – in the past – have paled in comparison to the ideas offered by ultra-progressive Sanders, who rolled out a massive $16 trillion Green New Deal plan this week.","['paled', 'ultra-progressive']",yes,"This would not be the first time Biden has been criticized for his ideas on combatting climate change, which – in the past – have been considered less ambitious compared to the ideas offered by Sanders, who rolled out a $16 trillion Green New Deal plan this week."
"Since the coronavirus pandemic began, emboldened pro-life groups have used the public health crisis to try to disrupt access to abortion.",['pro-life'],yes,"Since the coronavirus pandemic began, some anti-abortion groups have used the public health crisis to try to disrupt access to abortion."
"It probably has something to do with Pitlyk being a Federalist Society member, a former Brett Kavanaugh clerk, and a fierce opponent of reproductive rights who’s argued that fertility treatments and surrogacy have “grave” adverse effects on society.","['grave', 'fierce']",yes,"It probably has something to do with Pitlyk being a Federalist Society member, a former Brett Kavanaugh clerk, and an opponent of reproductive rights who’s argued that fertility treatments and surrogacy have significant adverse effects on society."
"Sanders praises the radical Green New Deal, champions a Medicare for All plan with a $34 trillion price tag, nods to abortion as a means of population control, and defends bread lines and Fidel Castro’s Cuba.",['radical'],yes,"Sanders praises the Green New Deal, champions a Medicare for All plan with a $34 trillion price tag, mentions abortion in the context of population control, and defends bread lines and Fidel Castro’s Cuba."
Debates about the viability of school voucher programs have focused in recent months on programs with lackluster or spotty academic records. But there’s another issue raised by the potential expansion of public financing for private schools: an exacerbation of segregation.,"['lackluster', 'spotty', 'exacerbation']",yes,Debates about the viability of school voucher programs have focused in recent months on programs with inconsistent or underwhelming academic records. But there’s another issue raised by the potential expansion of public financing for private schools: an increase in segregation.
"After witnessing the right-wing reaction to Greta Thunberg, the teenage climate activist from Sweden who spoke at the United Nations this week, there can be no doubt that modern-day conservatism, especially the Republican Party, functions primarily as a protection racket for the fragile egos of mediocre white men.","['egos', 'protection', 'racket', 'mediocre', 'fragile']",yes,"After witnessing the right-wing reaction to Greta Thunberg, the teenage climate activist from Sweden who spoke at the United Nations this week, there can be no doubt that modern-day conservatism, especially the Republican Party, functions primarily to protect the interests of certain groups."
Emilie Kao went on to note that women’s sports has already been undermined by the transgender movement.,['undermined'],yes,Emilie Kao went on to note that women’s sports has been impacted by the transgender movement.
"This is one of the reasons why our politics seems so stuck. Not only do we have a hard time talking to each other, the very structure of our elections doesn’t require our politicians to even try. And when you win by turning out the base, why risk appealing to anyone else? A broken system not only elects politicians who need not listen to everyone, it actually incentivizes them to govern that way too.","['stuck', 'broken', 'system', 'incentivizes']",yes,"This is one of the reasons why our politics appears to be at an impasse. Not only do we have difficulty engaging in meaningful conversations, but the structure of our elections doesn’t encourage politicians to seek broader support. When you win by focusing on your base, why risk appealing to others? A flawed system elects politicians who are not required to listen to everyone, and it may even encourage them to govern in that way."
"But director Nick Sweeney’s forthcoming documentary on McCorvey, “AKA Jane Roe,” contains a major bombshell: her conversion from abortion rights icon to born-again Christian abortion opponent was “all an act.”","['abortion', 'bombshell']",yes,"But director Nick Sweeney’s forthcoming documentary on McCorvey, “AKA Jane Roe,” reveals a significant detail: her shift from being an abortion rights advocate to a born-again Christian opponent of abortion was “all an act.”"
"Oscar-winning actor Leonardo DiCaprio is a vocal climate change activist, however, he has taken some heat in the past for his preference for fuel-guzzling private plane travel.",['fuel-guzzling'],yes,"Oscar-winning actor Leonardo DiCaprio is a vocal climate change activist; however, he has faced criticism in the past for his preference for private plane travel."
"This unholy, unscientific alliance of right-wingers, COVID-19 truthers and anti-vaxxers became very clear recently following the viral spread of an anti-COVID-19 propaganda movie called “Plandemic,” featuring disgraced scientist-turned-anti-vaxxer ...","['propaganda', 'unholy', 'unscientific', 'right-wingers', 'disgraced']",yes,"This alliance of individuals, including some right-wing supporters, COVID-19 skeptics, and anti-vaccine advocates, became very clear recently following the viral spread of an anti-COVID-19 movie called “Plandemic,” featuring a scientist-turned-anti-vaccine advocate ..."
"The cancellation of Olympic qualifying events wreaks havoc with athletes waiting to advance, organizers and federations forced to find new venues — not to mention disrupting hotel reservations, airplane flights, and ticket reservations.","['wreaks', 'havoc']",yes,"The cancellation of Olympic qualifying events causes significant disruption for athletes waiting to advance, organizers, and federations who are forced to find new venues — as well as affecting hotel reservations, airplane flights, and ticket reservations."
"Climate change, which is the subject of fierce debate, may lead to a ""substantial increase"" in the number of extreme rainstorms, according to a startling new study by NASA.","['startling', 'fierce']",yes,"The cancellation of Olympic qualifying events causes significant disruption for athletes waiting to advance, organizers, and federations who are forced to find new venues — as well as affecting hotel reservations, airplane flights, and ticket reservations."
"Donald Trump appeared to make some important news via Twitter last night, announcing a dramatic new plan to use Immigration and Customs Enforcement (ICE) agents to remove “millions” of people from American soil.",['dramatic'],yes,"Donald Trump appeared to make some important news via Twitter last night, announcing a new plan to use Immigration and Customs Enforcement (ICE) agents to remove “millions” of people from American soil."
"This is all great news. It now looks like we have a safe, highly effective vaccine that has the potential to significantly reduce many forms of cancer. So why is it also becoming a key target of many anti-vaxxers?",['great'],yes,"This is positive news. It now looks like we have a safe, highly effective vaccine that has the potential to significantly reduce many forms of cancer. So why is it also becoming a key target of many anti-vaxxers?"
"While falling short of calling half the nation “deplorable” as former Secretary of State Hillary Clinton did in 2016, the comments echo a deep disdain for a large population of the country increasingly perpetuated by left-wing elites in the wake of the George Floyd protests characterizing the U.S. as irredeemably racist.","['deep', 'disdain', 'left-wing']",yes,"While not labeling half the nation as ""deplorable"" as former Secretary of State Hillary Clinton did in 2016, the comments reflect strong criticism of a large portion of the population, which has become more common among certain political elites following the George Floyd protests, which characterized the U.S. as racially unjust."
"This is how Warren has pushed the boundaries of progressive policy since coming to Washington. Instead of relying on the traditional D.C. think tank world, she made her office into her very own think tank.",['pushed'],yes,"This is how Warren has expanded the scope of progressive policy since coming to Washington. Instead of relying on the traditional D.C. think tank world, she made her office into her very own think tank."
Harris is also pushing legislation that would dramatically expand the legal and financial incentives for hundreds of thousands of Indian low-wage college graduates to take U.S.-based jobs from U.S. college graduates.,"['dramatically', 'take', 'pushing']",yes,Harris is also advocating for legislation that would significantly expand the legal and financial incentives for hundreds of thousands of Indian low-wage college graduates to pursue U.S.-based jobs alongside U.S. college graduates.
"The looting and riots and fires in blue cities across the country today reaffirm that it is not “justice” but “war” that today’s radicals have in mind. From a moment that brought all Americans together in their sense of right and wrong, politicians and groups bent on destabilizing the nation chose division…and got their way.","['blue', 'cities', 'radicals', 'bent', 'destabilizing', 'war']",yes,"The looting, riots, and fires in various cities across the country today reaffirm that it is not “justice” but “conflict” that some protesters may have in mind. From a moment that brought all Americans together in their sense of right and wrong, politicians and groups seeking to influence the nation’s direction chose division…and got their way."
"Instead, they want to force women and their doctors to subject dying newborns to further horrific medical intervention, to needles and lights and loud voices and scalpels and machines that will only prolong the inevitable, only prolong their pain.","['horrific', 'force', 'inevitable', 'prolong']",yes,"Instead, they want to require women and their doctors to subject dying newborns to additional medical intervention, including needles, lights, loud voices, scalpels, and machines, which will only extend their suffering."
