biased_sentence,biased_words,rephrase_possible,debiased_sentence
"More than 100 gang members from El Salvador are among the massive wave of migrants that's poured across the border in recent months, with nearly 400 illegal immigrants nabbed trying to cross en masse last week and a group of more than 100 caught scaling a wall Monday, beleaguered border officials said.","['beleaguered', 'massive', 'wave']",yes,"More than 100 gang members from El Salvador are among the large group of migrants who crossed the border in recent months, with nearly 400 undocumented immigrants apprehended while attempting to cross in a group last week and a group of more than 100 caught scaling a wall Monday, according to border officials."
Gadsby's work is a testament to how eagerly the arbiters of our culture will devour and elevate work that convincingly purports to be progressive.,"['elevate', 'devour']",yes,Gadsby's work is a testament to how readily the arbiters of our culture will promote and support work that appears to be progressive.
That’s led some vaccine foes to join the protesters — whom Trump has encouraged on Twitter — in staging demonstrations in state capitals to “reopen America.”,"['foes', 'encouraged']",yes,That’s led some vaccine opponents to join the protesters — whom Trump has supported on Twitter — in staging demonstrations in state capitals to “reopen America.”
"That’s why white nationalists, who are enthusiasts for the abortion of black and brown people, despise pro-lifers, as anyone reporting in good faith should know.","['enthusiasts', 'despise', 'pro-lifers']",yes,"That’s why white nationalists, who support abortion access for black and brown people, oppose anti-abortion advocates, as anyone reporting in good faith should know."
"Biden was particularly critical of Trump’s visit on Monday to a historic church across from the White House, which was preceded by law enforcement authorities dispersing a crowd near the church with smoke canisters and flash grenades.",['critical'],yes,"Biden expressed disapproval of Trump’s visit on Monday to a historic church across from the White House, which was preceded by law enforcement authorities dispersing a crowd near the church with smoke canisters and flash grenades."
Young women taking part in high school and college athletics across the country have had their dreams of winning dashed by the movement to allow biological male who “identify” as female to compete against them.,"['dashed', 'identify']",yes,Young women taking part in high school and college athletics across the country have faced increased competition due to policies allowing transgender women to compete in female categories.
"Under current immigration policies, it’s possible that immigration arrests could lead to poor mental health by increasing deportation fears among undocumented individuals and their families and neighbors, the study authors write.","['poor', 'mental', 'health']",yes,"Under current immigration policies, it’s possible that immigration arrests could negatively affect psychological well-being by increasing deportation fears among undocumented individuals and their families and neighbors, the study authors write."
"Less-organized migrants, tighter immigration control by Guatemalan authorities and the presence of U.S. advisers have reduced the likelihood that the hundreds of migrants who departed Honduras will form anything like the cohesive procession the term “caravan” now conjures.",['caravan'],yes,"Less-organized migrants, tighter immigration control by Guatemalan authorities and the presence of U.S. advisers have reduced the likelihood that the hundreds of migrants who departed Honduras will form anything like the cohesive group often referred to as a “caravan.”"
"Trump enjoys and encourages state brutality against people of color, and black people in particular. It excites him and his most ardent followers. But his response isn’t just based on personal predilections. It’s also based on political considerations.","['brutality', 'encourages', 'excites']",yes,"Trump supports law enforcement measures that disproportionately affect people of color, particularly black individuals. His response appears to be driven not just by personal preferences but also by political considerations."
"Abortionists, who prey on desperate people, should no longer receive your hard-earned tax dollars.","['prey', 'Abortionists']",yes,"Medical providers who perform abortions should no longer receive government funding, according to critics."
The Trump administration has continued to deny climate change findings and make scientific reports inaccessible to the public.,['deny'],yes,The Trump administration has continued to question climate change findings and limit public access to scientific reports.
"In the months that followed, all independent polling has found the American mainstream not only blames Trump and his party for the shutdown, but also does not want to spend billions of taxpayer dollars on an ineffective and unnecessary border wall.","['ineffective', 'unnecessary']",yes,"In the months that followed, all independent polling has found the American mainstream not only blames Trump and his party for the shutdown, but also does not support spending billions of taxpayer dollars on a controversial border wall."
"Kendrick, who, like many Planned Parenthood supporters, blames men for pro-life legislation while she ignores mention of the life of unborn babies, also drafted a “testicular bill of rights.","['blames', 'pro-life']",yes,"Kendrick, who, like many Planned Parenthood supporters, holds men responsible for anti-abortion legislation while she avoids addressing the issue of unborn life, also drafted a “testicular bill of rights.”"
"Abortion propaganda was always meant to obscure the reality of abortion, not justify it.","['obscure', 'propaganda']",yes,"Abortion messaging was always meant to present a specific perspective on abortion, not justify it."
"UFC Middleweight Champion Israel Adesanya’s comment that his opponent will ""crumble like the Twin Towers"", in addition to being terrible and inappropriate, also makes no sense.","['terrible', 'inappropriate']",yes,"UFC Middleweight Champion Israel Adesanya’s comment that his opponent will ""crumble like the Twin Towers"", in addition to being widely criticized, also makes no sense."
"Yet when researchers in the U.S. have been so corrupt they have gone to jail, mainstream scientists still accept their research.","['corrupt', 'mainstream']",yes,"Yet when researchers in the U.S. have engaged in unethical practices leading to imprisonment, other scientists still continue to reference their research."
"Donald Trump has taken heat for mostly refusing to mask up while performing his duties. This left the Biden camp with a choice to make when Joe woke up from political hibernation, and they went all in.","['political', 'hibernation']",yes,"Donald Trump has taken criticism for mostly refusing to wear a mask while performing his duties. This left the Biden camp with a decision to make when Joe resumed active campaigning, and they went all in."
"Omar believes USA Powerlifting is discriminating against males who identify as transgender women, based on the “myth” that they have a “direct competitive advantage” over biological females.",['myth'],yes,"Omar believes USA Powerlifting is discriminating against males who identify as transgender women, disputing the notion that they have a “direct competitive advantage” over biological females."
Christians should make clear that the perpetuation of objectionable vaccines and the lack of alternatives is a kind of coercion.,"['coercion', 'objectionable']",yes,Christians should make clear that the continued use of certain vaccines and the lack of alternatives may pressure individuals to make difficult choices.
"Democrats really don’t want to spend billions of taxpayer dollars on a giant, ineffective border wall, so if Trump were try to come up with an offer designed to entice them, he’d have to propose something that would be (a) enormous; and (b) wildly unpopular among Republicans.",['ineffective'],yes,"Democrats really don’t want to spend billions of taxpayer dollars on a giant border wall, so if Trump were to try to come up with an offer designed to entice them, he’d have to propose something that would be (a) enormous; and (b) widely opposed by Republicans."
"Before we get to work dispensing these arguments, it’s important to acknowledge that they are, on some level, understandable. A lot of Americans, especially those who got their bachelor’s degree before the early 2000s, find it baffling that younger generations can’t work their way through college.",['baffling'],yes,"Before we get to work dispensing these arguments, it’s important to acknowledge that they are, on some level, understandable. A lot of Americans, especially those who got their bachelor’s degree before the early 2000s, find it difficult to understand why younger generations can’t work their way through college."
"In July 2019, Rep. Alexandria Ocasio-Cortez, D-N.Y., and other Democrats visited a similar processing center in Clint, Texas, and made explosive allegations about the conditions there.","['explosive', 'allegations']",yes,"In July 2019, Rep. Alexandria Ocasio-Cortez, D-N.Y., and other Democrats visited a similar processing center in Clint, Texas, and raised serious concerns about the conditions there."
"Just because our attention is on the coronavirus, that doesn't mean the elephant in the room — climate change — is going anywhere.",['elephant'],yes,"Just because our attention is on the coronavirus, that doesn't mean the critical issue of climate change is going anywhere."
"As Breitbart News most recently reported, blue-collar Americans in landscaping, conservation work, the meatpacking industry, construction industry, and fishing jobs have had their wages dragged down by foreign workers imported through the H-2B visa program.","['dragged', 'down']",yes,"As Breitbart News most recently reported, blue-collar Americans in landscaping, conservation work, the meatpacking industry, construction industry, and fishing jobs have experienced wage competition due to foreign workers imported through the H-2B visa program."
"In August, Planned Parenthood made the decision to opt out of the federal family planning grant program, portraying itself as a victim of the Trump administration.","['portraying', 'victim', 'itself']",yes,"In August, Planned Parenthood made the decision to opt out of the federal family planning grant program, citing policy changes by the Trump administration as the reason."
State health departments and legislators who sneer at parental concerns and call for vaccination mandates erode parents’ trust.,"['sneer', 'erode']",yes,State health departments and legislators who dismiss parental concerns while calling for vaccination mandates may reduce parents’ trust.
"Cuban slave doctors that have escaped the system have said that, while working abroad, the Castro regime forced them to invent patients and throw away perfectly good medicine to boost the statistics on the number of patients Cuban doctors actually treat.","['slave', 'escaped', 'perfectly', 'good']",yes,"Cuban doctors who left the system have said that, while working abroad, the Castro regime pressured them to invent patients and discard usable medicine to boost the statistics on the number of patients Cuban doctors actually treat."
British Olympic swimmer Sharron Davies also slammed the concept of transgender athletes.,['slammed'],yes,British Olympic swimmer Sharron Davies also criticized the concept of transgender athletes.
"Biden’s appearance was a contrast with the approach of Republican President Donald Trump, who has made no major public statement to address the growing crisis but issued tweets as he remained out of sight in the White House.",['contrast'],yes,"Biden’s appearance differed from the approach of Republican President Donald Trump, who has made no major public statement to address the growing crisis but issued tweets while staying in the White House."
Sen. Josh Hawley (R-MO) introduced two bills on Tuesday to target the “monopolies” higher education institutions have created to make earning degrees involve accumulating massive student debt.,"['massive', 'monopolies']",yes,Sen. Josh Hawley (R-MO) introduced two bills on Tuesday to address the influence higher education institutions have in making earning degrees result in significant student debt.
The Trump Administration hasn’t built a single foot of border fencing after thirty months of riling up its supporters with claims that the wall was vital to national security.,"['riling', 'single', 'up']",yes,The Trump Administration has not built any border fencing after thirty months of making claims that the wall was vital to national security.
"As part of his plan to protect the commonwealth of Virginia from the spread of the Wuhan coronavirus, Gov. Ralph Northam determined that citizens should not be allowed to attend church or worship services, but are fine travel to an abortion clinic and undergo an elective procedure like surgical abortion.","['fine', 'Wuhan']",yes,"As part of his plan to protect the commonwealth of Virginia from the spread of the coronavirus, Gov. Ralph Northam determined that citizens should not be allowed to attend church or worship services, but are permitted to travel to an abortion clinic and undergo an elective procedure like surgical abortion."
"Countless American believers in the Bible, myself included, were inspired tremendously on Monday when President Trump stood in front of St. John’s Episcopal Church, across the street from the White House, and held up the Word of God for all to see.","['included', 'tremendously', 'inspired', 'Word', 'of', 'God']",yes,"Many Americans who follow the Bible felt motivated on Monday when President Trump stood in front of St. John’s Episcopal Church, across the street from the White House, and held up a Bible for all to see."
"To bolster the argument that doctors deliver viable infants alive and let them die, the anti-choice movement also trots out a series of people who claim to have “survived” abortion.","['trots', 'anti-choice', 'survived']",yes,"To support the argument that doctors deliver viable infants alive and let them die, the movement opposing abortion presents a series of people who claim to have been affected by abortion."
"Shelby Steele, a senior fellow at Stanford University’s Hoover Institution said Friday that the contemporary civil rights movement under the banner of “Black Lives Matter” was deeply unserious, catering to an old form of victimization that has accomplished nothing to lift up black people.","['deeply', 'unserious', 'accomplished', 'nothing', 'victimization']",yes,"Shelby Steele, a senior fellow at Stanford University’s Hoover Institution, said Friday that the contemporary civil rights movement under the banner of “Black Lives Matter” focuses on longstanding issues but has yet to demonstrate significant progress in improving conditions for black communities."
"Vaccine critics, for example, have long championed the false claim that vaccines cause autism, and that the Centers for Disease Control and Prevention has tried to cover up that information, Gorski said.","['false', 'claim', 'cover', 'up', 'championed']",yes,"Vaccine skeptics, for example, have long promoted the claim that vaccines are linked to autism, and that the Centers for Disease Control and Prevention has withheld related information, Gorski said."
"Having a baby is hard, caring for a baby is hard, going back to work after a leave is hard but a few weeks of salary is not worth killing your baby for.","['killing', 'your', 'baby']",yes,"Having a baby is hard, caring for a baby is hard, and going back to work after a leave is hard, but financial concerns should not outweigh important personal decisions about parenthood."
"After that phone call, police asked the couple to come in for questioning, prompting them to flee Saudi Arabia, a country long known for draconian laws against homosexuality.",['draconian'],yes,"After that phone call, police asked the couple to come in for questioning, prompting them to flee Saudi Arabia, a country with strict laws against homosexuality."
Drivers in Ireland will be forced to buy electric vehicles within ten years according to a new law by the left-wing government in Dublin.,"['forced', 'left-wing']",yes,Drivers in Ireland will be required to transition to electric vehicles within ten years under a new law introduced by the government in Dublin.
Lots of politicians and critics across the board have attacked the Green New Deal proposed last week by freshman Democrats Rep. Alexandria Ocasio-Cortez of New York and Sen. Ed Markey of Massachusetts.,['attacked'],yes,Lots of politicians and critics across the board have criticized the Green New Deal proposed last week by freshman Democrats Rep. Alexandria Ocasio-Cortez of New York and Sen. Ed Markey of Massachusetts.
"In the dominant political fight in D.C., Donald Trump wants a giant wall along the U.S./Mexico border.","['dominant', 'giant']",yes,"In the ongoing political debate in D.C., Donald Trump proposes building a large wall along the U.S./Mexico border."
"While President Donald Trump’s impeachment trial had been wrapping up, he expanded one of his most controversial and inflammatory policies with little fanfare and minimal opposition: the travel ban on people from multiple Muslim-majority countries.","['controversial', 'inflammatory']",yes,"While President Donald Trump’s impeachment trial had been wrapping up, he expanded one of his most debated policies with little public attention and minimal opposition: the travel ban on people from multiple Muslim-majority countries."
A push by Virginia Democrats to loosen restrictions on late-term abortions is erupting into a fierce partisan clash as video of a legislative hearing goes viral.,"['erupting', 'fierce', 'clash']",yes,A push by Virginia Democrats to modify restrictions on late-term abortions is leading to a significant partisan debate as video of a legislative hearing gains attention.
"And most egregiously, in what will surely be viewed as one of the most ill-advised stunts in presidential history, the Trump Administration had federal security forces use tear gas and projectiles to vacate Lafayette square by force of arms so Trump could make a show of walking over to St. John’s Church and posing awkwardly with a bible held upside down.","['egregiously', 'ill-advised', 'stunts', 'awkwardly', 'show']",yes,"In a widely criticized move, the Trump Administration had federal security forces use tear gas and projectiles to clear Lafayette square, allowing Trump to walk over to St. John’s Church and hold a bible for a photo opportunity."
"Franciscan friar Father Daniel Horan, a pro-LGBT priest and professor who will be speaking at the upcoming Los Angeles Religious Education Congress, took to Twitter this weekend to bash the March for Life and condemn without trial a group of white Catholic high school boys as “racists” for supposedly “taunting” a Native American man beating a drum.","['bash', 'racists', 'taunting', 'pro-LGBT', 'condemn']",yes,"Franciscan friar Father Daniel Horan, a priest and professor who will be speaking at the upcoming Los Angeles Religious Education Congress, shared his criticism of the March for Life and expressed disapproval of a group of Catholic high school boys for allegedly confronting a Native American man beating a drum."
"Given these bleak prospects, students who go to college to “find themselves” are likely to waste precious time and money because they lack a clear vision.","['bleak', 'precious', 'time', 'money', 'clear', 'vision', 'waste', 'lack']",yes,"Given these uncertain prospects, students who go to college to explore their interests may spend time and resources without a defined plan."
"People keep getting sick and the economy is cratering, but for Republicans, hating women is still a major priority: republican governors in Texas, Ohio and even Maryland are trying to use the coronavirus crisis as an excuse to block women from getting abortions, claiming that ending a pregnancy is a “nonessential” medical procedure that must be rescheduled.","['cratering', 'hating', 'women', 'excuse', 'nonessential']",yes,"People continue to get sick and the economy is struggling, but some Republican governors in Texas, Ohio, and even Maryland are using the coronavirus crisis as a justification to limit access to abortion services, claiming that ending a pregnancy is a “nonessential” medical procedure that must be rescheduled."
The Times’ about-face was just one example of a little Orwellian campaign that’s sprung up in the liberal media since the Disneyland measles outbreak to try to rewrite history by shoehorning vaccine opposition into the shopworn trope that it is conservatives who are “anti-science.”,"['Orwellian', 'campaign', 'liberal', 'media', 'rewrite', 'shoehorning', 'anti-science', 'about-face', 'history', 'shopworn']",yes,"The Times’ change of direction was one example of an effort that has emerged in media since the Disneyland measles outbreak to present vaccine opposition as a viewpoint primarily held by conservatives, often portrayed as being against scientific consensus."
It wasn't long after Donald Trump and his team took office that they looked for ways to make things easier for polluters.,"['easier', 'for', 'polluters']",yes,It wasn't long after Donald Trump and his team took office that they looked for ways to ease regulations for industries involved in pollution.
We should expect growing support for this item for a few reasons: Younger voters of all political stripes are being exposed to the status quo student loan system. Younger voters are also less likely to accept the toxic brand of “conservatism.”,"['toxic', 'brand', 'conservatism']",yes,We should expect growing support for this item for a few reasons: Younger voters of all political stripes are being exposed to the status quo student loan system. Younger voters are also less likely to accept the conservative approach to these issues.
"President Donald Trump bragged on Sunday that the Republican Party has never been stronger or more united than it is now, even as his impeachment trial is set to begin in the Senate this week.",['bragged'],yes,"President Donald Trump stated on Sunday that the Republican Party has never been stronger or more united than it is now, even as his impeachment trial is set to begin in the Senate this week."
"If sports don’t trump religion as the opiate of the masses, they have, until recently, been at least the background music of most of our lives.","['background', 'music', 'trump', 'opiate', 'masses']",yes,"If sports don’t surpass religion in significance for the masses, they have, until recently, been a constant presence in most of our lives."
No amount of denial from pro-choicers can change the fact that many post-abortive mothers carry the grief of a severed parent-child bond with them.,"['pro-choicers', 'grief', 'severed', 'parent-child', 'bond', 'post-abortive']",yes,No amount of denial from individuals who support abortion rights can change the fact that many women who have undergone abortions experience emotional distress due to the loss of a parent-child connection.
"A federal judge in Tucson, Arizona delivered a blow Monday to the Trump administration’s strategy of criminalizing humanitarian aid work along the southern border with her decision to overturn the convictions of four volunteers on religious freedom grounds.","['blow', 'criminalizing']",yes,"A federal judge in Tucson, Arizona dealt a setback to the Trump administration’s strategy of restricting humanitarian aid work along the southern border with her decision to overturn the convictions of four volunteers on religious freedom grounds."
"Former ESPN personality Jemele Hill attacked the NFL for its lack of black coaches, and blasted the Rooney Rule as an insufficient solution to the problem.","['blasted', 'attacked']",yes,"Former ESPN personality Jemele Hill criticized the NFL for its lack of black coaches, and described the Rooney Rule as an insufficient solution to the problem."
A leader of a movement that urges women to brag about having an abortion promoted the procedure to children in a video from Cut’s HiHo on the YouTube channel.,['brag'],yes,A leader of a movement that encourages women to speak openly about having an abortion promoted the procedure to children in a video from Cut’s HiHo on the YouTube channel.
"In fact, the scenario of killing babies after they're born that Trump depicted was ridiculously false.",['ridiculously'],yes,"In fact, the scenario of killing babies after they're born that Trump depicted was false."
"Hungarian Prime Minister Viktor Orban, a staunch anti-immigrant populist, said on Wednesday a new wave of migrants trying to cross the border from Turkey into the European Union must be stopped as far south as possible and his government was ready to help frontline Greece.","['staunch', 'populist', 'anti-immigrant']",yes,Hungarian Prime Minister Viktor Orban said on Wednesday a new wave of migrants trying to cross the border from Turkey into the European Union must be stopped as far south as possible and his government was ready to help frontline Greece.
"House Speaker Nancy Pelosi (D-CA) on Monday waxed hyperbolic about the 2020 presidential election, telling an audience that “civilization as we know it is at stake.”","['waxed', 'hyperbolic']",yes,"House Speaker Nancy Pelosi (D-CA) on Monday spoke passionately about the 2020 presidential election, telling an audience that “civilization as we know it is at stake.”"
